<?xml version="1.0" encoding="UTF-8"?>
<!DOCTYPE Mensajeria SYSTEM "./dtd/ejercicio1.dtd">
<Mensajeria>

    <pedido>

    <Destinatario codCliente="A5">
        <nombre></nombre>
        <direccion></direccion>
    </Destinatario>

    <producto >
        <tipo_producto></tipo_producto>
        <importe></importe>
    </producto>

    <Dia_entrega>
        <fecha></fecha>
    </Dia_entrega>
    

    </pedido>

</Mensajeria>